{"schema":"paraforge-architecture","version":1,"input":{"type":"grid","height":16,"width":16,"channels":4},"output":{"type":"grid","height":16,"width":16,"channels":4},"parameters":[{"id":0,"kind":"linear","input_features":16,"output_features":4},{"id":1,"kind":"linear","input_features":12,"output_features":16}],"operation":{"type":"repeat","count":4,"body":{"type":"sequential","first":{"type":"copy","input":{"type":"grid","height":16,"width":16,"channels":4},"output":{"type":"product","left":{"type":"grid","height":16,"width":16,"channels":4},"right":{"type":"grid","height":16,"width":16,"channels":4}}},"later":{"type":"sequential","first":{"type":"parallel","left":{"type":"sequential","first":{"type":"sequential","first":{"type":"sequential","first":{"type":"fixed_convolution","height":16,"width":16,"kernel":{"type":"nca_perception","channels":4,"boundary":"zero"}},"later":{"type":"linear","height":16,"width":16,"input_features":12,"output_features":16,"parameter":1}},"later":{"type":"activation","height":16,"width":16,"channels":16,"activation":"relu"}},"later":{"type":"linear","height":16,"width":16,"input_features":16,"output_features":4,"parameter":0}},"right":{"type":"identity","shape":{"type":"grid","height":16,"width":16,"channels":4}}},"later":{"type":"add","height":16,"width":16,"channels":4}}}}}
